{
  "$schema": "https://spec.agentproviders.dev/schemas/agents.v1.json",
  "name": "llm-prefill-decode-visualizer",
  "description": "LLM inference performance math: TTFT, TPOT, walltime for single-turn chat, agentic loops, batched serving, speculative decoding, and KV-cache VRAM. Includes community-measured hardware benchmarks.",
  "url": "https://llm-prefill-decode-visualizer.vercel.app",
  "docs": "/llms.txt",
  "endpoints": [
    {
      "path": "/api/compute",
      "method": "GET",
      "description": "Run inference math. ?model=singleTurn|speculative|batched|agentic|kvCache plus parameters. No model param returns a self-describing capability list.",
      "returns": "application/json"
    },
    {
      "path": "/api/presets",
      "method": "GET",
      "description": "Built-in hardware speed presets (RTX 4090, dual RTX 3090, M3 Ultra, Groq LPU, H100, RPi5) and workload scenarios (RAG, code generation). Feed these into /api/compute.",
      "returns": "application/json"
    },
    {
      "path": "/api/localmaxxing",
      "method": "GET",
      "description": "Community-measured single-stream benchmark runs. No params = hardware summary; ?hardware=<substr> or ?model=<substr>&limit=N filters runs with measured prefill/decode tok/s.",
      "returns": "application/json"
    }
  ],
  "auth": "none",
  "cors": true
}
